review_id,store,rating,title,text,review_date,language,char_count
play_store:968ff4f4-2fa7-49e1-93d8-c7e0b50b8d6f,play_store,1,,previous complaint or query has been duly resolved. but the latest version of app has deteriorated the home page user interface by squeezing the rise and fall of daily various indices trend placed at the top that display ed both points and percentage change together. Restore the older layout as soon as possible,2026-04-07,,312
play_store:9f8346f1-8ab9-413f-a86f-51be8ec4b222,play_store,1,,very high brokrage charges. i use grow for watching stock and also use kotak neo for buy or sell,2026-04-07,,96
play_store:aa68b8e2-a44f-4676-a0e8-47dd56da6a91,play_store,1,,please don't remove the old index icon it is better,2026-04-07,,51
play_store:acfa46aa-aaa6-4b16-8051-1099f045bb1c,play_store,1,,Roll back to the previous version the view of the top was very compressed not looking good,2026-04-07,,90
play_store:b2215be8-4536-4677-962d-847f2a810053,play_store,5,,"best hai Welcome to Gboard clipboard, any text you copy will be saved here.1",2026-04-07,,76
play_store:b35b538c-03af-4c9e-abcf-aaa742bab069,play_store,2,,this version is very bad. The old version was good.,2026-04-07,,51
play_store:b41ce7e1-1088-43c2-973a-17a23aa8ce9e,play_store,5,,GROWW app has the best UI amongst all Investment related Apps hands down. But you should incorporate a customization option for everyone.,2026-04-07,,137
play_store:b945fcdd-d551-49d5-b837-643f2383a63d,play_store,1,,worst update of app seen in April 2026 with reducing sensex and nifty 50 points showing in a single row.,2026-04-07,,104
play_store:c02ba42c-eb0c-4cfb-af4e-9127e9ce018f,play_store,1,,"very weird UI of new update not able see clearly the Nifty & sensex in one go always need to click to see % , previous one more better to get in one go, please go back to previous one , ASAP else need to switch to another app. it's really frustrating.",2026-04-07,,251
play_store:cc738875-4fc4-4ba6-a33b-5653d1411fe7,play_store,5,,"loved the reports.... everything one wants to know about a company, is right here....",2026-04-07,,85
play_store:d0d9bbc9-91d8-485d-b9bb-67ad0d5818e1,play_store,5,,this is very good trading platform Groww grow karo,2026-04-07,,50
play_store:d8d736bc-17e9-4f07-911b-9e9105f7ab80,play_store,4,,"Your earlier nifty index indicator was really great for visual at top position, but after update the latest it's not like comfortable. Pls make it as it was or make it movable with bold.",2026-04-07,,186
play_store:da18d39e-8168-419b-94bd-f1d1f5558b62,play_store,1,,Recent UI design for indices is so bad. it feels like it's non existent. Please make it bigger so that we can quickly overlook how the market is performing for the day. Thanks.,2026-04-07,,176
play_store:eeaaf9dc-eb22-4506-bdb0-61f2b3d1a68b,play_store,1,,"Due to so called technical issue of this grow app i had my lose of 7000 amount Please resolve my issue , or give me legal way to",2026-04-07,,128
play_store:f1a72a0c-b570-483d-a0dc-ac460962817f,play_store,1,,"Even after selling stocks, charges keep getting deducted until the amount is fully settled. It doesn’t matter at what price you sell the stock—they still continue deducting from your wallet until it matches the current market value. Shame on you, Grow. This is unacceptable.",2026-04-07,,274
play_store:f35b18ef-d1c3-4aab-9ad9-94a2bad1edc2,play_store,5,,"one of the best stock market app in the world. but trading view chart may indicators ko save krnay vali option nhi hai, please vo bhi provide krva dijiay tn jo baar baar indicators ko na lgana pdy bs apni save indicators vali option py click kro aur indicators lga lao. thanks",2026-04-07,,276
play_store:f618804c-36f8-4353-9f15-4b56a070a934,play_store,1,,this app is not for any use this distroy the timings of people,2026-04-07,,62
play_store:f63f799b-0a65-4ee9-93f7-a8430bb738dd,play_store,5,,now the app is updated with more features. I am very happy to using this app,2026-04-07,,76
play_store:fe378618-24af-457d-9bc8-ec00f81e47e6,play_store,1,,latest update was so bad nifty sensex figures are smallest get them back to big size,2026-04-07,,84
play_store:fe865929-3b11-41bc-aebb-729baaf09531,play_store,4,,bring A New Feature Integrating Family portfolio into one,2026-04-07,,57
play_store:0778bf4b-41ce-485c-a065-28152140005d,play_store,5,,add notes in app so that we can have watchlist with written notes,2026-04-08,,65
play_store:0bf8c64f-9c29-459b-b037-67094b2823f9,play_store,1,,"worst ui update previous ui was best, reverse it chain ui frequently not good",2026-04-08,,77
play_store:0eaabeb6-bc6a-4b46-83aa-d5f953cfb1fc,play_store,2,,l love groww. but recent update like change format of index interface is very bad ... ugly,2026-04-08,,90
play_store:1542b2a7-c3d4-4bdb-aeb6-1d9e1d6546af,play_store,1,,very smile size for live market vision vary bad experience this last update,2026-04-08,,75
play_store:2fa37836-5606-44c3-89b9-b9f60206821b,play_store,4,,groww is the good brokerage app totally free no annual fee And new user best app,2026-04-08,,80
play_store:3941ea63-c53a-4c87-b1b9-162f57361302,play_store,5,,good app for beginners as well as professional,2026-04-08,,46
play_store:39e0478c-e776-454e-9d00-83fc5704a644,play_store,1,,The old UX and UI was clean simple and better! New UI has accessibility challenges and needs additional steps to get critical information like %High/Low of Sensex.,2026-04-08,,163
play_store:4b4ae0bd-8d43-4aea-998b-55558db5d8e4,play_store,5,,"great ui, makes easy, comfortable to use and understand.",2026-04-08,,56
play_store:555f2a3b-545a-4055-bf86-b953c82f7bb8,play_store,1,,bekar experience sabse ghatiya app grow app..mai suggest karunga koi bhi grow app use na kare..na hi koi other app..koi app acha nahi h ..sab brokerage khane baithe h .... app kabhi profit me nhi aaoge...apni jindagi kharab karni hai tabhi ye app use kare or barbad hojye..... serious telling everyone..not to use app..kamao or khao..but trading investing na hi karo in apps ke through..bahut loss hua h mujhe sab jgh trading investing hr jgh .so please careful,2026-04-08,,461
play_store:62157712-a47e-4251-b100-0aae8cf8673c,play_store,1,,"High brokrage charge. High hidden charge and extra charge, CUSTOMER SUPPORT 0 DO'NT OPEN ACCONT THIS BROKER",2026-04-08,,107
play_store:79af9ecd-8ac6-48c5-aa6e-c1af5b591fbc,play_store,5,,excellent and easy user interface provided by this app.,2026-04-08,,55
play_store:83e9ba9a-ccd7-4d07-8fe4-b88b4a0b0c68,play_store,5,,"best User interface Compare to all other trading platform,good app nice experience.",2026-04-08,,83
play_store:8851c84d-6d4a-4e88-962b-b9b1992f95b3,play_store,1,,"very poor UI/UX earlier one is better, why the indices were removed from encircled box , very bad experience",2026-04-08,,108
play_store:9b1c9422-2658-4c7f-b126-b251ba76bd7f,play_store,1,,Third class app. its third day I m unable to selly stock and all they are giving is ASSURANCE,2026-04-08,,93
play_store:b834af51-dc9b-481b-a0e1-2a7c5056c30f,play_store,5,,GROWW IS THE BEST TRADING NO 1 PLATFORM IN INDIA,2026-04-08,,48
play_store:bd14ff62-f9ca-4777-a189-65baaba7b39b,play_store,1,,"the worst broking app , many glitches whilentrading i won't recommend using it",2026-04-08,,78
play_store:c46f75ca-87be-4ef7-8507-4ae25572e470,play_store,1,,"Whenever I am doing any money transfer, it takes 4 hours because of this. A lot of loss of money is happening. This is totally unreliable. People should be giving one star to this application.",2026-04-08,,192
play_store:ca0df8e6-a551-4882-9fcd-b03922bbbf4a,play_store,1,,"The latest update has completely messed up the scaling on the Stocks tab. The Nifty 50 and Sensex tickers are pushed into the status bar and cut off by the notch, making it impossible to read key indices at a glance. ​What’s frustrating is that the Mutual Funds and Loans sections are fine—this is clearly a lack of basic QA testing on the Stocks dashboard before pushing the update.What’s worse is the ""support."" I raised a ticket and sent an email with clear screenshots of the bug, but they close",2026-04-08,,499
play_store:ca3915f8-c957-484a-8d13-46323f2368c0,play_store,1,,recent app look very poor ....small nifty sensex section....now what diff bty so called complex interface stock app vs groww,2026-04-08,,124
play_store:cb80d355-7331-4f7e-abcf-56ac2d20adf6,play_store,1,,Called customer care for an issue. Waited 5 minutes in queue only for the Groww executive to disconnect the call without saying or hearing a word. Haven't received any callback till now. Pathetic customer service.,2026-04-08,,213
play_store:d720ac7c-c9d3-4fa5-b8d1-6ce6622361c3,play_store,1,,set safe exit there in app!???? plz tel,2026-04-08,,39
play_store:d767ef79-a638-4d3b-99cd-dab1fdd9deab,play_store,5,,"Groo App is simple, fast, and very easy to use. I like how it focuses only on useful features instead of adding unnecessary stuff. The interface is clean and beginner-friendly, and everything runs smoothly without lag. It gives a distraction-free and well-optimized experience, making it reliable for regular use. Overall, a great app that offers a smooth and hassle-free experience—definitely worth trying.",2026-04-08,,407
play_store:f421892d-2e9c-49f9-864b-74c1e46a1e69,play_store,5,,"one of the best apps for both traders and investors, I came here as an investor this app offers a clear and easy user interface, shows each and every detail about stock, ETF and MTF's I would truly recommend you to download this!",2026-04-08,,229
play_store:f7bbd065-6724-42be-af91-d4deed951ffd,play_store,2,,"An average app for learner bcoz the chart lags, don't hit SL , not good for scalping.",2026-04-08,,85
play_store:1e268ebe-71b3-42f9-8312-4e4dc38f2b3f,play_store,1,,very high brokerage. and after trade is executed they show profit is 1000 rupee but dont show that 100 150 ruppe will be deducted in the end only 8-900 rupee get credited . but when u have loss like 1000 rupee then they dont show brokerage will also be deducted so full deduction will be 1100-1200. it is a pre plannned thing to keep users in shadow.,2026-04-09,,350
play_store:21223cb7-59db-4afd-8033-4d79c52c0eb8,play_store,3,,the new app design is really a downgrade from previous one. when I open app I don't just want to see numbers about current market trend I want to see it by percentage as well. I want to see by how many percentage the market is up or down. please bring that back please...,2026-04-09,,271
play_store:3c9c36ba-2d98-41c5-86fd-5dce62394da3,play_store,1,,Top Cheap!! order didn't execute on time!!,2026-04-09,,42
play_store:4a8f6fe8-6cba-4078-ac24-f5e2e1054fe9,play_store,1,,There is no disclose quantity option when placing an order while all other brokers do have this feature.,2026-04-09,,104
play_store:4ad9491e-2791-473c-9b7c-b72b1d6b5ab7,play_store,1,,your money withdrawal is very very bad,2026-04-09,,38
play_store:55143a26-bf8e-427b-87fe-1f07bb29d8bc,play_store,5,,"I used many Dmat account like Zerodha, Angelone, up stocks. But this​(Groww)Demat account—it’s very simple, efficient, and user-friendly. It is the perfect Demat account for my long-term investments and daily trading journey.",2026-04-09,,225
play_store:574b46a1-2f46-4f25-bfed-e641fa9c00b0,play_store,1,,worst app not deliver anything on time,2026-04-09,,38
play_store:5a049fe3-0d22-4081-9ca9-8c274c0a51c1,play_store,1,,bht salo phle se id bnayi thi or email id bhoo gye lekin mobile number vhi h to login nhi ho rha h koi customer care support nhi h koi help nhi krte,2026-04-09,,148
play_store:5a0549eb-015c-433c-941a-34b45787cbe4,play_store,1,,"I had invested on 6th April 2026, which was not a trading holiday. However when raised a query to Groww, it said 6th April 2026 is a trading holiday and 7th being a settlement holiday the units were issue with 8th April 2026 NAV, which had an increase of 0.3 in NAV as compared to 6th April 2026. Resulting in lesser units allocated to me. This is how they earn.",2026-04-09,,362
play_store:66e31149-aa38-4adc-8e18-601a796f861e,play_store,1,,service very poor 5 minutes baad order sell or buy ho rha,2026-04-09,,57
play_store:6aa3cf79-fd9a-4383-b497-c4bf755aaff9,play_store,1,,irresponsible customer agent.. call live agent regarding glitch report ...agent cut call purposefully..and never call back,2026-04-09,,122
play_store:72213c30-4911-4d20-9fa8-722ddb902fb6,play_store,1,,this app is not good many time it's hang,2026-04-09,,40
play_store:7f5401ce-01d3-45b4-8fe5-95f498f72a88,play_store,4,,best of Groww Stock mutual fund app,2026-04-09,,35
play_store:7f8bbd5c-6725-4945-8537-231a22198928,play_store,5,,"“The Groww app is easy to use, but during market hours it often becomes slow and orders get delayed. Please improve the app’s speed and performance.”",2026-04-09,,149
play_store:867841bd-6392-4c78-8110-05e9312e3a87,play_store,5,,the best stock market app i see in life,2026-04-09,,39
play_store:8dc03679-c873-4f40-8acf-0f60debd3b46,play_store,5,,very nice a very useful to me,2026-04-09,,29
play_store:8e494ecd-0c10-423c-a4fc-a9c09097100f,play_store,5,,best experience with clear options to understand easily best for beginners,2026-04-09,,74
play_store:a1fef8dd-bfed-4ba5-bcf7-b46b59f1a070,play_store,1,,very high intraday Brokerage be aware before using,2026-04-09,,50
play_store:a43c8e1c-5aa5-4d13-a104-6d3523b3980f,play_store,1,,"It is one of the worst app and their service,I had press limit order they automatically execute on market price,I had complaint regarding this he said that you had press the market order he can't accept their fault,they are doing for increase their revenue from stealing customer money. Very bad experience. don't use .........",2026-04-09,,327
play_store:b1510abc-2dcc-4c98-97d1-d31e74fbb886,play_store,5,,I absolutely love this app and its UI. The portfolio analysis system needs to be improved. It needs to calculate values and show visual representations more accurately and in a better way.,2026-04-09,,188
play_store:b8d9c3da-d90c-4ecf-a02e-2b8d4053e683,play_store,5,,How to find out good panny stock.places help me fandamatal right stock,2026-04-09,,70
play_store:bea9bb44-8a43-4192-a8af-bb76d339b856,play_store,4,,good app but brokerage charges is to high and sometimes you face some glitches,2026-04-09,,78
play_store:c3a5a972-aed5-4a2a-a8b1-bd3e9d76ba93,play_store,5,,overall app services is best working experience,2026-04-09,,47
play_store:d0e93905-2778-4e80-a19d-a6c63d194a78,play_store,5,,"I have had a great association with GROWW, over 3",2026-04-09,,49
play_store:d78d5504-ac32-4119-8956-44ee33b92abb,play_store,1,,"I called on 09.04.2036 at 04:15 PM, and Ms. Sraya attended the call. For the customer’s convenience, I informed her about my issue that the app was not refreshing. However she was not aware of this basic issue. I would like to suggest that the Groww app team should ensure proper training for customer support executives so they can assist users more effectively. In my opinion Ms. Shreya is not fit I called again at 04:25 PM, and this time a male answered the call and provided proper assistance",2026-04-09,,497
play_store:fb998d81-9a78-4ca0-b685-ad1c8366ada8,play_store,1,,yesterday when I try to exit he showing some technical issue can't exit I loss 10000 rs,2026-04-09,,87
play_store:0017e39f-e3da-4fc9-a974-c563a5930a7e,play_store,3,,"Imagine i make position in index which have monthly, weekly and day expiry and weekly and day expiry, expired on same day and P&L graph show total p&l then how can I analyse my day expiry and weekly expiry p&l which one have performed well or for this i have to open account in two different brokers.",2026-04-10,,300
play_store:06aabece-2a02-402f-9963-37299e2746d0,play_store,1,,"charges are increased too high, more than others",2026-04-10,,48
play_store:101e7d94-5e21-4fae-b297-91aa833870c2,play_store,5,,"""Groww has made investing so simple and hassle-free. Tracking my portfolio is very easy, and there are no hidden charges. It feels very secure and reliable. If you're looking to start your investment journey, this is the app to go for!""",2026-04-10,,236
play_store:1061aa32-37f7-4285-95dd-f6216574be3c,play_store,5,,Nice! and a simple app for investments.,2026-04-10,,39
play_store:160c555d-204a-4de3-896f-67608a95861d,play_store,4,,please create separate section for etf... so i don't show in folio stock lists,2026-04-10,,78
play_store:49c710f7-24a1-437e-bd66-11fdeffcc4f9,play_store,5,,Mind-blowing Experience & User-friendly interface.. love it.,2026-04-10,,60
play_store:5ccda89f-7821-466a-8839-da19b1cada75,play_store,1,,"1st of all , they loot u by executing ur trade at significantly different price than market. it's very difficult to put limit trade. and it's soo intrusive that they fetch all ur details without asking u. can't even see charts without giving Pan",2026-04-10,,245
play_store:5d3aedaf-c24c-409d-9f3b-1d946f7c248e,play_store,5,,super app all in just ome click and easy to use,2026-04-10,,47
play_store:5fb048b6-e4df-4495-a8c5-3a97a50d3418,play_store,5,,excellent aplication one more update required in your app which is unable scalping features on regular f& o charts because of that we can trail our sl which are more beneficial to every trader every trader required it so please update it,2026-04-10,,237
play_store:7563e933-09c2-418f-8f7f-4edac083e6fe,play_store,1,,Whose bright idea was it to put that AI front page on your app?,2026-04-10,,63
play_store:7809d139-f990-4006-a081-0d1db893cedc,play_store,5,,"please introduce more widgets for Android... for tracking index, perticular stock.",2026-04-10,,82
play_store:865e5d87-243b-4053-b743-467a47b19e49,play_store,5,,good to go with trading and investment the best thing is no charges,2026-04-10,,67
play_store:88da6da7-471e-44aa-b018-cccb87beb9c6,play_store,5,,grow is my favourite app . because I can invest everywhere and any time grow experts are very helpful. if you need urgent money you can withdraw any time .,2026-04-10,,155
play_store:8e943f64-e80f-4b06-9c10-10014c7fe9d1,play_store,1,,"Previous UI interface was good for mf, it's now difficult to track the data changes. Also you have removed the portfolio allocation for mf which was one of the great and usp of groww. I know we can check some allocation data in active and passive split but earlier screen was user friendly. in this you have divided in different split which is really frustrating to understand.",2026-04-10,,377
play_store:8f698462-8a97-415a-a38b-23a0a01d6565,play_store,1,,"Groww is giving MTF for fraud stocks also like RNB DENIMS i have taken for 10 lakhs my amount was allready loss and MTF amount also 80 % loss scammer WhatsApp group only recommended to install groww for this stock for MTF any other brokers have not given MTF to That stock due to this for their business Groww is giving for waste stocks also , there should be think while giving MTF atleast they should close while investor money got drained I don't recommend this brokerage",2026-04-10,,474
play_store:9dfd1993-812b-41b6-a58e-90295315f20e,play_store,4,,"Key Missing Feature: 2-Leg Orders in Delivery & GTT Groww is great, but lacks 2-leg orders (SL + target) for Delivery & GTT Buy/Sell—available only in Intraday. Busy users miss out on automated exits for long-term trades. Also add Disclosed Quantity option.",2026-04-10,,257
play_store:b51ffa59-07de-40c8-8b8d-8a13cb4f7342,play_store,5,,groww is the best app for trading and investment but in the last update they changed one thing which i didn't liked is they minimized the indices section before the update it was like the current market price was in the black and positive or negative were shown below it in green or red colour which i liked but now they minimized it,2026-04-10,,333
play_store:b554e643-484f-4700-9b40-d628ee97ad01,play_store,2,,mu bank accounts not attach by grow app,2026-04-10,,39
play_store:b8226820-beef-4457-8d69-b386f8039aec,play_store,5,,Fast and easy going– a simple plateform for investment and trading.,2026-04-10,,67
play_store:b8978721-8c29-484d-aa42-a2d05f2cfbe4,play_store,1,,"it's been more than a week since I installed this app, still kyc shows in progress and not able to trade. Despite chasing customer care the only response every time received is to wait for 48hr , no result. Very disappointed with this behaviour.",2026-04-10,,245
play_store:de7e4866-1aaa-4769-955c-199259450b4a,play_store,2,,Name grow but not Growing I am sad about the charges,2026-04-10,,52
play_store:94ee479b-d13b-4a18-a943-fd2f6479500a,play_store,5,,good app I can earn millions of dollar,2026-04-11,,38
play_store:c6266faa-2a03-4ae6-8dcd-435942b4b52d,play_store,2,,most time I am facing technical issues when already on a trade i face more capital loss with this issue,2026-04-11,,103
play_store:ce1d0c58-bd50-4dbf-9f75-31b6e835f879,play_store,5,,You can earn any amount of income per month by using this app.,2026-04-11,,62
play_store:d253b1b7-d2ea-4174-9842-6c193adc1433,play_store,5,,very nice User interface that i like a lot. The sign up process is really simple and makes things alot nicer,2026-04-11,,108
play_store:dcc15a52-ed2e-4830-b82c-3aa864b36b77,play_store,4,,I have installed it in my ipad but the interface is not completely synced. it is showing the phone compatible dimensions. is there any other app for iPad.?,2026-04-11,,155
play_store:dd150fe4-1438-4e69-937b-696c5c8c6cee,play_store,4,,What I am saying is why can't we withdraw only our profits without selling the shares? please provide this feature This will increase your app market.,2026-04-11,,150
play_store:ebfd960d-72ff-4430-ba4a-b9819ae64e2f,play_store,1,,"I am unable to refresh my external funds, it asks to go to mf Central but clicking on it leads to a blank screen., facing this issue from almost a month now on my xiaomi phone...",2026-04-11,,178
play_store:f52e18fa-8abf-4dcc-83d1-46ebc62df860,play_store,1,,"worst app ever, there service is worse. they don't even help anyhow when things go wrong because of there own server problem, going to delete this app",2026-04-11,,150
play_store:f5719a63-13b1-47b3-9cf5-64fd112875c3,play_store,5,,I think it's a good app for beginners who want to understand stock market.,2026-04-11,,74
play_store:fce7b240-4de7-4b22-9a64-8f0a4e90a688,play_store,1,,I getting error while logging into this app from last 4 days. Your onboarding journey has expired.,2026-04-11,,98
play_store:058f47fe-f89a-487b-b07e-57748463a09c,play_store,4,,"Rest everything is good, but it can be more comfortable if app will have option of currency trading & while using the app in any segment & closing in the same , after starting next time app will start from home page or segment lock . so that no one can see the portfolio status....",2026-04-12,,281
play_store:2e2d02c3-eabd-4dd1-b279-f859b87e7c7e,play_store,5,,"groww is the bestest app i ever seen it's very useful for me or also is very simple and easy to use, i thought downloading groww is the best desicion of my life, and i have no words to tell how much i love this app.",2026-04-12,,215
play_store:35ee4ac1-d977-450f-aa2d-8059fcd92a34,play_store,1,,groww new update of chart not good than I switch to zerodha,2026-04-12,,59
play_store:47b79138-45d4-456d-bb41-a58cefb223cb,play_store,1,,"After reviewing all the comments, i was scared to install this app",2026-04-12,,66
play_store:53603be7-7b1a-4f95-94b6-58711d9c78be,play_store,5,,"a perfect trading , ease of use. very friendly UI",2026-04-12,,49
play_store:715851e3-c6a6-4146-a65c-6bdab102f5bf,play_store,1,,very poor support.. tried to sign up with correct details. Made several Attempts but failed to sign up. worst experience,2026-04-12,,120
play_store:79888724-dd1d-4d01-ba78-8af3fd2f66f1,play_store,5,,Very Friendly And Easy-to-use Interface Of the App And Groww Team is 24/7 There to Help You In Any Issues You Face.Indian Youth Loves This App And Earning & Learning financial Freedom I Easy Way Altogether,2026-04-12,,205
play_store:7b5dafe0-5630-421e-ad4b-fde36eeb27bf,play_store,3,,give an ipad view plz.it looks so bad in ipad,2026-04-12,,45
play_store:e141b2dc-8d61-44d5-a08a-fbe3ec1e2c9f,play_store,5,,"I have been using Grow for a few years now, Simply UI/UX, Love it.",2026-04-12,,66
play_store:e920fd12-324c-4b53-ba6f-93994f445af3,play_store,5,,"nice app for beginners traders & investors, yet simple format with most of trading features.",2026-04-12,,92
play_store:0305aa55-2ce1-4bc9-94d8-fddd0a5dfbc3,play_store,5,,it's a fabulous app to invest our own money for new learners,2026-04-13,,60
play_store:06c9d176-aa36-47c2-963e-b927331638f0,play_store,3,,Your Returns Calculator for Mid150 Index fund is showing wrong calculation. While it is showing +40% in ETF in 3 years It is showing only +9% in all Mid150 Index mutual funds For SIP,2026-04-13,,182
play_store:0fe982a0-3f89-4096-a612-01e84a9d43a5,play_store,1,,WROST APPLICATION YOUR MONEY WILL BE LOCK 5 DAYS YOU CAN'T WITHDRAW ALSO YOU HAVE BEEN CHARGED WRONG BROKRAGE WITH OTHER TAXES,2026-04-13,,126
play_store:10b29166-3d7e-4970-b6db-c0f6ac1f8f81,play_store,5,,"As of now the app is doing very well and keeps on updating with new features. Also, Can you provide a 'Notes' option in the app where we can store key notes in the app itself, once login to the application first we should get redirected to the Notes section which reminds 'what we planned earlier and what to plan for the future'. Please take this consideration, it will be very good for the users to maintain short notes in the app itself.",2026-04-13,,440
play_store:1dbdafe7-18b5-4082-9840-f9bdc55bdb69,play_store,5,,I m new to this app but still it's easy to use,2026-04-13,,46
play_store:26da3f5d-52c0-4e0f-813a-ef10657f2a01,play_store,5,,It is soo best app for stock market I like like this app soo much you can install this app surely without any fear..,2026-04-13,,116
