review_id,store,rating,title,text,review_date,language,char_count
play_store:fadbb448-2b28-4401-b3c3-4ed520b5fc78,play_store,1,,This App is fek and Extra Charge,2026-04-24,,32
play_store:fd4f545b-ccce-4128-b90d-4ad49248c595,play_store,1,,beech market me app stop working...it's loading it's more than 15min,2026-04-24,,68
play_store:322e43eb-5c6a-4950-92df-2e8ad9f6af2a,play_store,1,,You guys should give an option for instant withdrawal You are asking me to return the money I withdrew yesterday after just four days.,2026-04-25,,134
play_store:3960bc00-2c9c-4ed0-8709-153eadb96e8c,play_store,3,,I cannot see the holdings tab values for the last couple of days and the issue is still not resolved yet . Am I the one facing this issue or everyone ? UI wise app looks good and easy to track. kindly address the above issue,2026-04-25,,224
play_store:40ff8e83-e0ca-454a-bf98-ecba5f610af6,play_store,5,,"The best sip planner helped me plan five different life goals,",2026-04-25,,62
play_store:e190fa8d-0dd7-42d2-851e-d4be34903bbb,play_store,1,,Why does mutual fund redemption process take 6 days,2026-04-25,,51
play_store:eff7cbee-64d6-4853-ba28-913f6ed3aabd,play_store,1,,refund amount should be given to any bank account of original holder ....remove cheque book photo copy proof option,2026-04-25,,115
play_store:f73e1241-487e-4801-8a89-6be833377733,play_store,1,,Never use this application if you face any problem then customer care not support properly and they delay to take call if this call disconnected they do not call back to you. And their charge is high from other plate from. So don't use grow application for trading.,2026-04-25,,265
play_store:0faa460c-e567-4fa8-a60d-aa72058e4a65,play_store,5,,"good, but brokerage fee increased for equity stocks.",2026-04-26,,52
play_store:6ab422a5-38b0-429a-b293-1377e0cbc85f,play_store,1,,"all expense ratios are incorrect on Groww. that's not acceptable. For ex, TrustMF Midcap or TrustMF small cap is mentioned 2%, in reality it's 0.45%.",2026-04-26,,149
play_store:77d72bb2-7346-47e1-b457-70e1650e2965,play_store,1,,lost my old mobile phone unable to login and not even able change the number so jumped to kite!!,2026-04-26,,96
play_store:a704c374-6fe3-4651-aee3-183961d0962d,play_store,1,,Various drawings gets deleted after a day. So analysis drawings has to be drawn again. Also Daily closing Candle of Index showing different value after market is closed though Index Value shows actual closing price at Home Page. Your technical team needs to work on it or else you are going to lose customers.,2026-04-26,,309
play_store:ba7da774-6f8a-4b2c-85f5-5d3cdc6be327,play_store,4,,"i like to short my stock in the basis of industry so that i can easily buy and sell the stock based on the news regarding the industry (like power sector sock catagory,automobile etc )",2026-04-26,,184
play_store:05bb6a8c-7706-4b01-8bed-51a1516e6394,play_store,3,,"[REDACTED], this app is not working in landscape mode, please try to fix it. overall good.",2026-04-27,,90
play_store:0992587b-77ec-434a-a5ab-b918d764b0a5,play_store,1,,sometimes app does work when it's important to make a trade,2026-04-27,,59
play_store:0bc8dea8-03b6-4177-b111-92beb9b602cf,play_store,1,,"again today I am Unable to buy or sell share ,and I have loss ammount",2026-04-27,,69
play_store:160dc2c9-d385-4f15-af02-f981d0a98a91,play_store,1,,"don't use groww , mtf system is very bad , amounts, credits and bedits regarding mtf is not showing properly don't use this app for mtf",2026-04-27,,135
play_store:1c189b62-f105-40d9-b187-204cdf7faf0f,play_store,1,,i am not able to see my holding! solve this issue ASAP!,2026-04-27,,55
play_store:1c21c2c0-0270-4ec8-a1c0-8fdc1072c7b0,play_store,1,,Not reliable for regular traders. It lags in the peak time and you can loss you huge money in the minutes. In my personal experience I was trying to close the trade or trying to convert it into delivery on 3:10 PM but due to error in the app I was not able to either close or extend it and has exit on its own not recommend at all.,2026-04-27,,331
play_store:3efee59d-a53e-416a-8e72-6a5bc1df4cb6,play_store,2,,at the moment when i sell my option primium groww suddenly can't work wht i do,2026-04-27,,78
play_store:44a3d62e-3fab-4cef-96f7-5c86d2faed5c,play_store,1,,App crashed. Error:Failed to load data. Unable to see or do anything just before market close.,2026-04-27,,94
play_store:4657b98f-4b9a-442e-b74a-e3dc403abb12,play_store,1,,Order had been excited but not showing in balance credited and showing something wrong what's this ?,2026-04-27,,100
play_store:4edcedfc-6ea6-4423-85c4-d459e68c6d35,play_store,1,,"one day this app give problems near expiry after 3 , will give you huge loss in option , not fully reliable at all, due to app problem u will made loss",2026-04-27,,151
play_store:5a06486b-45ea-4c7b-8f82-ee5f90e9eb28,play_store,2,,"grow is unable to modify my sell price, resulted rs. 39000 loss.",2026-04-27,,64
play_store:5bfd987a-17fa-4fa7-ac23-48bc62a2debc,play_store,5,,This application is very useful classy and smoothly run in window I really like this application.,2026-04-27,,97
play_store:5c651ffc-6f88-4979-afa1-31315e41c188,play_store,4,,Logout to be add on home screen.,2026-04-27,,32
play_store:5e1da983-8edf-41db-b026-dc38c39204ff,play_store,1,,cash withdrawal issues manegement intentionally stuck the withdrawal after waiting period.very bad experience several times for money withdrawal,2026-04-27,,144
play_store:635f7ff6-17de-4ee0-a1df-52c0728b3b86,play_store,1,,I'm using this app around 6 years... Transaction charges are very high as compared to other apps & execution is very slow .... Kindly reduce price otherwise lots of people quite the app,2026-04-27,,185
play_store:6b681753-622d-4cb0-ad29-09a32780b64d,play_store,3,,"the app doesnt load and currently just not able to use the app at all. not able to connect to support either via chat or phone, or email.",2026-04-27,,137
play_store:6eb0d2de-450d-474f-b489-256ddbe965fe,play_store,3,,Five stars from me because this app gave me a new means of earning which allows me to do my other work without any hindrance.,2026-04-27,,125
play_store:7137ab61-0220-41a2-93fe-5a4a64584be9,play_store,5,,app interface is very good stock research is also good best ui need some accuracy in changes,2026-04-27,,92
play_store:717a6122-455f-4943-9d4a-1453c5a3fe11,play_store,1,,Why does everything is wrong? Completely wrong data visible for my Mutual funds. I harvested amount is modified. MF central statement shows updates data but here on your application everything is wrong. Please fix it as soon as possible.. This will help me.,2026-04-27,,257
play_store:720bee80-7fde-49bf-892b-f3c268fc34e0,play_store,4,,fair from any other similar app Rating decrease from earlier,2026-04-27,,60
play_store:731f3a37-aa2b-4959-9ce4-8afa2f97b46f,play_store,5,,too good too fast & fully secure,2026-04-27,,32
play_store:73c47421-95ae-4b2c-8515-037ae5903230,play_store,1,,cant see my mutual fund dashboard after new update,2026-04-27,,50
play_store:75656241-cc47-44da-8cb2-7f0e958dd13b,play_store,1,,wrost app i ever use specially for mutual fund.some time show different balance then available balance,2026-04-27,,102
play_store:792db7c7-ab51-4964-be8d-f9b1cf3617e7,play_store,1,,after latest it is showing less investment than actual in mutual fund,2026-04-27,,69
play_store:83ca4edf-95b7-4440-8757-106e96a7a4c1,play_store,4,,"Sometimes not working properly, glitch in refreshing.",2026-04-27,,53
play_store:8533e0e2-2333-42ca-a20a-012f0543aee2,play_store,4,,There is no SWP option in this groww app(mobile App) that's why I gave 4 stars rating only. We want SWP option in this app for more investing in mutual funds. Which App has SWP option for mutual funds that is the good. Dear groww App team members Please insert SWP option for investing in mutual funds.,2026-04-27,,302
play_store:8fd24ada-c029-4bef-b374-2e76af422869,play_store,1,,"it's the worst, I was investing for like 13 months in two SIP's and cancelled one of them today but after doing this my dashboard is showing less than 50% of my invested amount. Before cancelling one of my SIP my dashboard showed 5000 something and now it's spinning only 1000 something. I wanted to raise this query on their helpline but their chatgpt isn't working and also whenever I try to call on their helpline number it always does it's busy. So if you love your money, keep it away from groww",2026-04-27,,500
play_store:9322193a-d83b-4e78-99b4-f0a9b89a25ed,play_store,1,,today I was buying a call in the itm option and I had sufficient balance actually I had 5 6k extra than the balance needed but my order was still not placed I tried again and again and now I am not able to view my balance i am not able to contact the customer support I am really disappointed and now I am just changing my broker,2026-04-27,,329
play_store:944938ab-88f8-4cad-aa7d-f4a2e5c8d6a6,play_store,1,,I was using groww from past maybe 2 year ... but now I am going to delete it. they are taking too much charges maybe this app is good for investing not for trading at all,2026-04-27,,170
play_store:98e11327-d73a-4149-a184-2a9430591567,play_store,5,,"india number one top broker.. very fast, simple. many many thank you Groww",2026-04-27,,74
play_store:9d929873-246d-4912-9fb5-b320d601ffb7,play_store,3,,Market Goes Up But The price Go Down for call side this is Glitch ? or Application issue please solve it .,2026-04-27,,106
play_store:a0085787-8865-4308-8963-8a38ac70015b,play_store,1,,Server down. failed to trade today for 1 hour. failed to add money,2026-04-27,,66
play_store:ac7628e0-2b5a-4039-b864-239e5e7508fe,play_store,1,,Never ever do F&O trading in Groww.,2026-04-27,,35
play_store:ae87721e-15db-4a76-ad19-23b471a3ca96,play_store,1,,"Very poor experience with Groww. During market hours, I was unable to exit my position manually even before 3:20 PM as the app was unresponsive. My intraday position was then delayed in square-off from 3:20 PM to 3:25 PM (as confirmed by their support). In those few minutes, my trade went from 927 profit to 2000 loss. In intraday trading, even small delays can cause serious losses. This raises concerns about platform reliability during critical times. Please consider switching to another broker",2026-04-27,,499
play_store:afafdb9a-5c0b-496b-8908-482c4cce90c4,play_store,1,,"This app is very worst worst app, regarding 1.customer care not responding 2. app strucked in between option buying/selling 3. many complaints given but no response",2026-04-27,,164
play_store:b0ed00a7-6ef2-46d7-be91-3c086edc1a1e,play_store,1,,added money today but app shows no funds !!!!,2026-04-27,,45
play_store:b33ce423-8d1b-498f-9976-495bbe00e012,play_store,1,,all of sudden all my MF are gone I am seeing my old portfolio now about 2 months old one. both on web and app. I am afraid now,2026-04-27,,126
play_store:b8c593d0-3db7-42e0-bd93-92b36a8d8ea2,play_store,3,,They keep showing bugs like invested amount to 0,2026-04-27,,48
play_store:bd44e34b-4685-430f-9f2e-c83d0d650a63,play_store,3,,sometimes i am getting something went wrong (Data fetching minious into an error) on screen.,2026-04-27,,92
play_store:c86f34ec-0417-4931-88ee-44c866951218,play_store,1,,What is your technical team doing? The app crashes every time in critical situations.,2026-04-27,,85
play_store:d1aa8e56-de28-47cc-8349-7da7207a9b60,play_store,1,,"since 3 Year I am unable to use biometric, multiple attempts done by uninstalling and reinstalling app.",2026-04-27,,103
play_store:d1e0de73-6f0b-4a23-8ca0-32ca56ea4b10,play_store,2,,"Dark pattern - showed me ""activate F&O "" interstitial with the options pre selected, just after opening the app. Usually in its place, there is some informative banner that you're just accustomed to dismissing at a click. Did not expect this from Groww.",2026-04-27,,253
play_store:d38048e7-93d6-484f-b8c3-299625e348dc,play_store,1,,Worst Customer Support Service There is an issue with return values,2026-04-27,,67
play_store:d45a509c-bc9b-4c6a-aec3-a7362d5f09ec,play_store,1,,always technical issues.. my sip dashboard not proper show.. I always try to customer but always line is busy.,2026-04-27,,110
play_store:d867ffa4-5e0e-43a6-89e5-e30ab87157d6,play_store,1,,Taking high charges and giving useless service during Trade.,2026-04-27,,60
play_store:d868d35d-efc5-47c6-8c92-d9596ae51d04,play_store,2,,Not as expected. 1. Unable to find all report at one place. 2. Not able to show MF linked with Groww only once you had extracted your external funds. so you can't check performance of your MF purchased through groww. 3. MF can't be adjusted as per your own will. Supposed if you want to change your SIP from monthly to weekly it is not possible in grow. 4.,2026-04-27,,356
play_store:e0c82984-ebf1-43e8-a3f0-aa4bf217c300,play_store,1,,always lagged too much during peak hours,2026-04-27,,40
play_store:e278613a-6f36-488b-bd53-5f14159fc4fb,play_store,1,,"very bad app, iski galti hoti h aur loss customer ka hota h, aur koi b sunvai nhi hoti, ab mein dusre plateform me shift houga",2026-04-27,,126
play_store:e5d311d5-5bb5-4570-993f-93a95f105195,play_store,3,,"Great app! please add complete charts for 1hr, 1D time frame, currently it shows only 3 months data. which limits analysis to a certain time frame only",2026-04-27,,151
play_store:eaa3d0a4-97f0-4f8d-a7d8-c3b217f7d29c,play_store,3,,The customer support service is quite poor; please fix it.,2026-04-27,,58
play_store:eb4f65fa-e477-4dbd-857f-2bd06d426c5b,play_store,1,,"Bas app, be careful. Non supportive customer care. Maximum time number not connecting. Call cut down in between conversation if somehow connects. App frequently crashes. Today it crashed when I tried to exit from F&O and it doesn't load data. Throwback errors. Due to which I got into negative money and market closed and my money put on hold. Now, tomorrow is expiry and all premium will be cut out. I lost money. I am definitely uninstalling this app after collecting whatever left with me.",2026-04-27,,492
play_store:f6c66a20-7a01-44f6-a296-590a997b1381,play_store,1,,one of the worst experience today when I saw the mutual funds holdings amount wrong. I don't want to continue with this app anymore. Every now and then the app shows wrong data. I have lost faith in this app. Now u guys have made MF demat based which is difficult for me to shift.,2026-04-27,,280
play_store:fd81393f-7fa7-4b7b-8619-bf342cc18043,play_store,1,,"Be careful, their calculations are wrong on the balance. Not sure whether they are doing this intentionally to lure money. Then, their customer support. Create a ticket, in 1 hour they will close the ticket just giving some random reply.",2026-04-27,,237
play_store:1a7d4112-9032-4870-b8c2-ba955cc6375e,play_store,1,,slow speed & update on app for f&o as compare to Zerodha app. zerodha is faster execution compare to groww,2026-04-28,,106
play_store:56ad05b7-e675-4c92-bbe2-5f92fd62a1d3,play_store,1,,too much brokerage I do withdraw but still when I try to delete/ close my account it shows you need to pay 0.17 rs what the hell was that? it's not even brokerage charges,2026-04-28,,170
play_store:670cff10-4ac6-472b-9b3f-ea2d3192e68e,play_store,5,,"Minimum 3 updates in weakly, then neither proper depth is shown nor chart, day by day service is getting lost",2026-04-28,,109
play_store:b71c0c82-c4c2-4bc6-a7a0-94f7a7893df4,play_store,1,,I am using your app since 2023 regularly in f&o and i am very very disappointed about yesterday around 27/04/2026 3:15 there was a glitch in your application because of this I couldn't able to exit with 24350 call. This is horrible. Now I am unable to continue with groww any more,2026-04-28,,280
play_store:cbc1aa9b-f707-4169-bc9d-ff4951e99c8d,play_store,4,,grow app is giving good insight as well analyse of your investment,2026-04-28,,66
play_store:cdb5b3d9-dc08-4cdb-be96-1b100e7a3b32,play_store,1,,"behad ghatiya app, aur usse bhi ghatiya hai iski costomer care services",2026-04-28,,71
play_store:d77f8fee-8fd3-42c4-9e45-8a7ff0b23e80,play_store,1,,"profile analysis is not working sold stock is Also showing, as a holding kindly fix",2026-04-28,,83
play_store:e5548a15-d25a-43a0-a9ee-286aaacfb44f,play_store,4,,App are good but i can't add monney due to technical issue,2026-04-28,,58
play_store:f5c6ab21-00bf-41f3-9d96-3ddd3dc43cb9,play_store,1,,app is not opening...........third class app.. don't trust....,2026-04-28,,62
play_store:f7a81383-7a68-4c10-bd6c-525322e97f1f,play_store,1,,"They charge too much! Almost zero profit. Not recommended! One more thing: You can't withdraw your money after crediting your groww account, unless you've have used that money to trade first, (suffer gain or loss) Only then you are allowed to withdraw. Simply put, your money is stuck the moment you transfer it there.",2026-04-28,,318
play_store:f9670da6-00a6-4f80-9621-bc9fe1e74fe1,play_store,1,,"Extremely disappointed with the GTT feature lately. I've stopped receiving critical GTT execution notifications, which used to work fine. Despite raising multiple complaints, the issue persists. In trading, every second counts—this lag is unacceptable!",2026-04-28,,252
play_store:0f648e1c-81e1-4e25-a0df-e8d7254e2f79,play_store,3,,"I Like the App, Please Include One Cancel Other Order (OCO) Feature for Delivery Trading.. and I Want to See the Sector/Industry Performance by 1D,1W,1M,3M,6M,1Y timeframes with Sort Option, and Historical Data (Previous Days Daily Percentages)",2026-04-29,,244
play_store:11b55e7b-6e57-4f28-8e5c-22f0001d4d04,play_store,5,,I want 2 chart on single screen,2026-04-29,,31
play_store:2a0130c0-76ca-4868-bfc2-694b37d0fb4d,play_store,1,,i use grow app is more than 5 year but now grow is very bad and irritated app because i trade and app is not working properly slowly and hang very big bug not exit very early and much issues now i wil losses make to this app is bug ....so now some day i thinks is app owner game ...so plz not use grow my 5 year trust will now end ...i uninstall this app...very very very very badddd and you ask to AI answer is worst app for trading.,2026-04-29,,434
play_store:33feba71-778d-4a68-b52a-a2d21da0dfd1,play_store,2,,"I am very disappointed with Groww. The platform charges high fees on almost every transaction, whether the investment amount is small or large. There also appear to be extra or hidden charges, making it costly for investors. These high costs reduce overall returns and make the experience frustrating. Groww should improve transparency and lower its charges to support small investors. Currently, it does not feel user-friendly or affordable.",2026-04-29,,442
play_store:470f9e73-1481-43c3-ad69-03be3c3effad,play_store,5,,"Initially I was using three apps, Zerodha, Angelone, and Groww, now I use only the Groww app, All essential features with just one touch.",2026-04-29,,137
play_store:530c37ff-cbc6-4e96-9d56-5ae4d409c1b6,play_store,1,,"don't use this grow app ,,profit ka 60-70% brokerage kat tah hein ,,,I am a stock trader since 3 yr I switched to grow and total fraud app with extremely high brokerage,,,,,never use this app anyone",2026-04-29,,198
play_store:5e866fef-1f51-4189-b86c-aaff30fae938,play_store,1,,"Pay Attention to the prices and your money while trading on this Groww App. Multiple Discrepancies, lags while doing Transactions. After settlements, they deduct more amounts. The Auto-Square off didn't work and the intraday trade was dragged beyond 3:20 Auto-Square off time. Many Transactions look shady due to Discrepancies. Customer Support, app calls and emails, is Worst. No Resolution, help, ETA, or Support after numerous attempts. Better use a different reliable app.",2026-04-29,,476
play_store:8450648f-26c1-4974-92c6-f5b3dffa1b13,play_store,1,,Every day asking update. index expiry day asking update. Always asking update. particularly when taking order,2026-04-29,,109
play_store:92315bb2-f521-4689-b6c3-753c728ce25b,play_store,1,,"I added ₹1200 to my wallet. The stock price was ₹1171, but ₹1180 got deducted, there are too many hidden charges. The charges should be shown in the app, right? Why doesn’t it show this? This is not good. I thought I'm making money but instead I lost money with the hidden charges...agar negetive stars hote to wohi deti",2026-04-29,,320
play_store:9e37f7a9-4cc4-485e-9c31-6a434cdd78a9,play_store,1,,"iske mutual funds k paise apne aap kat jaate h. ya to ye ya fir inka staff krta hoga. par jhelna to hame h. mere kai saare Mutual funds k paise nikaala liya h. upar se nahi customer care se baat ho rhi or nahi complain pe kuch ho rha h. kindly resolve it & take strict action on it. otherwise no one will use this aap if you will cheat people. agar mere paise wapas ni hue to i will handover it to police. saare fraud hi h, customer support number pe call krne k baad OTP mangta h. How can I believe",2026-04-29,,499
play_store:c8278c82-269e-486d-8774-df7771adfd18,play_store,1,,The app structure for daily adjustments in wallets is not better and not showing the charges and daily trade details properly,2026-04-29,,125
play_store:df3abaec-a9a8-4d16-a5de-d670d6e397b0,play_store,1,,in grow app trading view chart is not working(9:15am to 3:30pm) . slove this trading view chart problem.................................................................................................................................................................................................................................................................................................................................................... ........................................................,2026-04-29,,500
play_store:010fbba6-bae0-4f12-a15a-d87b790792a7,play_store,1,,"I have lost my life in this app, I lost around 35 -40 Lakh rupees in total trading F&O. i completely became obsessed with this but no matter what I take if I pick Call and wait it goes put if I wait for put it goes call. Don't ever do F&O I have a family and lost job and life due to this app",2026-04-30,,292
play_store:19474a14-4d79-4d9c-9d6e-df5071ef89ba,play_store,1,,my order didn't executed for 10 min i tried and tried chat with their help support and they placed when all profit gone . I loss my 16000 profit give it back groww it's all your fault,2026-04-30,,183
play_store:4020ba13-81cc-42d8-bdd1-f7ffb881e928,play_store,1,,worst experience! I lost lots of money due to late execution. outdated features with high brokerage charges.,2026-04-30,,108
play_store:50794f9c-6fa8-42e6-acd5-f8f2b0744add,play_store,2,,showing the wrong track history and portfolio calculation which makes it hard to analyze my investment,2026-04-30,,102
play_store:5872b624-f79d-40b0-b6ba-fc144baa8a10,play_store,5,,This is the worst service by grow. During trading time how can this happens. Grow doesn't open since a hour. Who will pay my loss?,2026-04-30,,130
play_store:5e3819e6-4254-4ab3-92c7-4509d5cd1ea9,play_store,4,,all is topnotch but sometime it doesn't trigger set target prise.,2026-04-30,,65
play_store:74fd38b8-1ac7-4351-ada5-3ddc7ad6f9f0,play_store,1,,so much glitch in f&o trading even after calling to support team!,2026-04-30,,65
play_store:77766699-78f1-4112-b97f-6f82b18c9cbc,play_store,1,,slow execution thoda kam marketing khrach karo instead make the platform fast and responsive groww ho nhi Raha kahi tum log bhi buju jesi halt na ho jaye,2026-04-30,,153
play_store:80cb4960-d414-4014-99e2-d468480c38ba,play_store,5,,"I’ve been using the Groww app for a while now, and overall it delivers a clean and beginner-friendly investing experience. The interface is simple, intuitive, and makes it easy for new users to start investing in stocks, mutual funds and easy to add or withdrawal money",2026-04-30,,269
play_store:8a1ca9ee-8f39-469d-9f9c-2f64f798baa4,play_store,1,,instead of wasting money on advertisement you should invest money to improve your apps UI every time i try to open charts like stock or index chart it take much more time to load and mostly it says enable to load the chart,2026-04-30,,222
play_store:91c31330-bdfe-4932-ab70-d056887d5f98,play_store,1,,"Don't download it for stocks etf OR intraday, worst. for SIP it's okay u will work very hard to trade groww will charge a massive amount of BROKERAGE, after BROKERAGE no. of additional charges. just Don't don't download for daily trade instead go for other broker apps groww's UI is also too much navigation",2026-04-30,,307
play_store:96f0ab1e-9287-4ece-8385-a86afc4e1bcb,play_store,3,,when I suppose to sell it for example 135 and it is on 134 it doesn't sell and today that's why I got 2000 loss,2026-04-30,,111
play_store:b942514f-86de-421a-959a-4a747f1aa060,play_store,5,,it is a very good app it is very useful i like it,2026-04-30,,49
play_store:e994300a-fda6-42c1-9b5e-315f8f9810a0,play_store,1,,fraud app please don't use I am also facing problem,2026-04-30,,51
play_store:efbd582c-80ce-4b51-aecb-f5eede2bf06d,play_store,3,,The taxes and brokerage is costlier compared to Dhan and Zerodha but the smooth experience makes me forget that and it makes me wanting to stick with this app for trading but thee only thing which I fit is missing is 1) the trailing SL and target directly from charts(like the ones in Dhan app) which makes quite easier to trail both SL and target levels. 2) changing between stocks which are added your personal created wishlist from charts itself.,2026-04-30,,449
play_store:2023afdd-511a-44d8-94e9-26f3fa30cc0b,play_store,1,,"The customer service of grow is not good, withdrawal option is not available, they deliberately delay our amount for two days vr bad service from groww a friend suggest me for this but no any proper response from groww customer care I never suggest for this application.",2026-05-01,,270
